{
  "$schema": "../../schema/package.schema.json",
  "slug": "sample-forms",
  "type": "plugin",
  "categories": ["content-widgets", "anti-spam"],
  "tags": ["forms", "reference", "developer", "spam-filter"],
  "short_description": "Reference plugin demonstrating the Forms platform: contexts, field filters, spam veto, and submission hooks.",
  "license": "GPL-3.0-or-later",
  "support": {
    "issues": "https://github.com/mindstellar/shopclass/issues",
    "docs": "https://github.com/mindstellar/shopclass/blob/develop/docs/PACKAGE-SPEC.md"
  },
  "icon": "assets/icon.svg",
  "screenshots": [
    {
      "src": "assets/screenshot-1.png",
      "caption": "A submission labelled with the plugin's own placement"
    }
  ]
}
